Task Name,Phase,Status,Priority,Category,Estimated Hours,Dependencies,Notes,Due Date
"Implement content diff view for promotion","Phase 4: Publishing Workflow",Not Started,P1,Frontend,3,"Add promotion UI in admin panel","Show what will change",2026-04-22
"Add bulk promotion for multiple pages","Phase 4: Publishing Workflow",Not Started,P1,Frontend,2,"Add promotion UI in admin panel","Select multiple, promote all",2026-04-23
"Create promotion approval workflow (optional)","Phase 4: Publishing Workflow",Not Started,P2,Backend,4,"Add promotion UI in admin panel","Multi-step approval process",2026-04-23
"Manual test: Draft → publish workflow","Phase 4: Publishing Workflow",Not Started,P0,Testing,1,"Add publish button to page builder","Full workflow test",2026-04-24
"Manual test: Version rollback","Phase 4: Publishing Workflow",Not Started,P0,Testing,1,"Add rollback button in version history","Verify content restored",2026-04-24
"Manual test: Environment promotion","Phase 4: Publishing Workflow",Not Started,P0,Testing,2,"Add promotion UI in admin panel","Staging → prod test",2026-04-24
"Document publishing workflow","Phase 4: Publishing Workflow",Not Started,P1,Documentation,2,"Manual test: Draft → publish workflow","User guide for publishing",2026-04-25
"Create Phase 4 completion report","Phase 4: Publishing Workflow",Not Started,P1,Documentation,1,"Document publishing workflow","Lessons learned",2026-04-25
"Set up Google Cloud Storage bucket for assets","Phase 5: Asset Management",Not Started,P0,DevOps,2,"Phase 4 complete","Create staging and prod buckets",2026-04-28
"Configure bucket permissions and CORS","Phase 5: Asset Management",Not Started,P0,DevOps,1,"Set up Google Cloud Storage bucket for assets","Allow uploads from app",2026-04-28
"Implement file upload to GCS (backend)","Phase 5: Asset Management",Not Started,P0,Backend,4,"Configure bucket permissions and CORS","Generate signed URLs",2026-04-29
"Implement image optimization (sharp library)","Phase 5: Asset Management",Not Started,P1,Backend,3,"Implement file upload to GCS","Resize, compress, generate thumbnails",2026-04-30
"Create asset upload API endpoint","Phase 5: Asset Management",Not Started,P0,Backend,2,"Implement file upload to GCS","POST /api/cms/assets",2026-04-30
"Create asset list API endpoint","Phase 5: Asset Management",Not Started,P0,Backend,1,"Create asset upload API endpoint","GET /api/cms/assets with filters",2026-05-01
"Create asset delete API endpoint","Phase 5: Asset Management",Not Started,P0,Backend,1,"Create asset upload API endpoint","DELETE /api/cms/assets/:id",2026-05-01
"Create MediaLibrary component","Phase 5: Asset Management",Not Started,P0,Frontend,4,"Create asset list API endpoint","Grid view of assets",2026-05-02
"Implement drag-and-drop file upload UI","Phase 5: Asset Management",Not Started,P0,Frontend,3,"Create MediaLibrary component","Dropzone for files",2026-05-03
"Add file upload progress indicator","Phase 5: Asset Management",Not Started,P1,Frontend,1,"Implement drag-and-drop file upload UI","Progress bar per file",2026-05-03
"Implement asset thumbnail generation","Phase 5: Asset Management",Not Started,P1,Frontend,2,"Create MediaLibrary component","Display thumbnails",2026-05-04
"Create asset browser/picker component","Phase 5: Asset Management",Not Started,P0,Frontend,3,"Create MediaLibrary component","Modal for selecting assets",2026-05-04
"Add search and filter to media library","Phase 5: Asset Management",Not Started,P1,Frontend,2,"Create MediaLibrary component","Filter by type, search by name",2026-05-05
"Add asset tags functionality","Phase 5: Asset Management",Not Started,P2,Frontend,2,"Create MediaLibrary component","Tag assets for organization",2026-05-05
"Integrate asset picker with ImageBlock","Phase 5: Asset Management",Not Started,P0,Frontend,2,"Create asset browser/picker component","Browse assets in page builder",2026-05-06
"Add asset management page to admin","Phase 5: Asset Management",Not Started,P0,Frontend,2,"Create MediaLibrary component","Standalone asset manager",2026-05-06
"Implement asset lazy loading","Phase 5: Asset Management",Not Started,P1,Frontend,2,"Create MediaLibrary component","Load thumbnails on scroll",2026-05-06
"Add CDN integration (optional)","Phase 5: Asset Management",Not Started,P2,DevOps,3,"Implement file upload to GCS","Cloud CDN for faster delivery",2026-05-07
"Manual test: Upload various file types","Phase 5: Asset Management",Not Started,P0,Testing,1,"Implement drag-and-drop file upload UI","Images, PDFs, videos",2026-05-07
"Manual test: Image optimization","Phase 5: Asset Management",Not Started,P1,Testing,0.5,"Implement image optimization","Verify file sizes reduced",2026-05-07
"Manual test: Asset picker in page builder","Phase 5: Asset Management",Not Started,P0,Testing,1,"Integrate asset picker with ImageBlock","Select and insert assets",2026-05-07
"Document asset management usage","Phase 5: Asset Management",Not Started,P1,Documentation,1,"Manual test: Asset picker in page builder","User guide for media library",2026-05-08
"Create Phase 5 completion report","Phase 5: Asset Management",Not Started,P1,Documentation,1,"Document asset management usage","Lessons learned",2026-05-08
"Conduct usability testing with beta users","Phase 6: Polish & Testing",Not Started,P0,Testing,8,"Phase 5 complete","3-5 beta testers, 2 sessions each",2026-05-11
"Gather and document usability feedback","Phase 6: Polish & Testing",Not Started,P0,Testing,2,"Conduct usability testing with beta users","Create feedback report",2026-05-12
"Prioritize UI/UX improvements from feedback","Phase 6: Polish & Testing",Not Started,P0,Design,2,"Gather and document usability feedback","Create improvement backlog",2026-05-12
"Refine page builder interactions","Phase 6: Polish & Testing",Not Started,P1,Frontend,4,"Prioritize UI/UX improvements from feedback","Smoother drag-and-drop, better feedback",2026-05-13
"Improve form builder UX","Phase 6: Polish & Testing",Not Started,P1,Frontend,3,"Prioritize UI/UX improvements from feedback","Clearer field configuration",2026-05-14
"Polish visual design and styling","Phase 6: Polish & Testing",Not Started,P1,Design,4,"Prioritize UI/UX improvements from feedback","Consistent colors, spacing, typography",2026-05-15
"Add animations and transitions","Phase 6: Polish & Testing",Not Started,P2,Frontend,2,"Polish visual design and styling","Smooth state changes",2026-05-16
"Create onboarding tour for page builder","Phase 6: Polish & Testing",Not Started,P1,Frontend,3,"Conduct usability testing with beta users","Step-by-step guide for first use",2026-05-16
"Create onboarding tour for form builder","Phase 6: Polish & Testing",Not Started,P1,Frontend,2,"Create onboarding tour for page builder","Step-by-step guide for first use",2026-05-17
"Add contextual help tooltips","Phase 6: Polish & Testing",Not Started,P2,Frontend,2,"Create onboarding tour for page builder","Explain features inline",2026-05-17
"Optimize page builder rendering performance","Phase 6: Polish & Testing",Not Started,P1,Frontend,4,"Phase 5 complete","Lazy loading, virtualization, memoization",2026-05-18
"Implement lazy loading for blocks","Phase 6: Polish & Testing",Not Started,P1,Frontend,2,"Optimize page builder rendering performance","Load blocks on demand",2026-05-19
"Add caching strategies (frontend)","Phase 6: Polish & Testing",Not Started,P1,Frontend,2,"Optimize page builder rendering performance","Cache API responses",2026-05-19
"Optimize database queries (backend)","Phase 6: Polish & Testing",Not Started,P1,Backend,3,"Phase 5 complete","Add indexes, use select(), paginate",2026-05-20
"Add API response caching (Redis optional)","Phase 6: Polish & Testing",Not Started,P2,Backend,3,"Optimize database queries","Cache published pages",2026-05-20
"Reduce bundle size (code splitting)","Phase 6: Polish & Testing",Not Started,P1,Frontend,3,"Optimize page builder rendering performance","Lazy load page builder, form builder",2026-05-21
"Run Lighthouse performance audit","Phase 6: Polish & Testing",Not Started,P1,Testing,1,"Reduce bundle size","Target: 90+ score",2026-05-21
"Write unit tests for critical paths","Phase 6: Polish & Testing",Not Started,P0,Testing,8,"Phase 5 complete","usePageBuilder, useFormBuilder, services",2026-05-22
"Write integration tests for APIs","Phase 6: Polish & Testing",Not Started,P1,Testing,6,"Write unit tests for critical paths","Test all API endpoints",2026-05-23
"Write E2E tests with Playwright","Phase 6: Polish & Testing",Not Started,P0,Testing,8,"Write integration tests for APIs","Full user workflows",2026-05-26
"Test all user workflows end-to-end","Phase 6: Polish & Testing",Not Started,P0,Testing,4,"Write E2E tests with Playwright","Create, edit, publish page/form",2026-05-27
"Perform load testing","Phase 6: Polish & Testing",Not Started,P1,Testing,3,"Test all user workflows end-to-end","Simulate multiple concurrent users",2026-05-27
"Run security audit (OWASP)","Phase 6: Polish & Testing",Not Started,P0,Testing,4,"Test all user workflows end-to-end","XSS, CSRF, SQL injection, etc",2026-05-28
"Fix security vulnerabilities","Phase 6: Polish & Testing",Not Started,P0,Backend,4,"Run security audit","Address all critical/high issues",2026-05-29
"Test browser compatibility","Phase 6: Polish & Testing",Not Started,P1,Testing,3,"Write E2E tests with Playwright","Chrome, Firefox, Safari, Edge",2026-05-29
"Test mobile/tablet responsiveness","Phase 6: Polish & Testing",Not Started,P2,Testing,2,"Test browser compatibility","May limit builder to desktop",2026-05-30
"Write user guide for content editors","Phase 6: Polish & Testing",Not Started,P0,Documentation,8,"Conduct usability testing with beta users","Complete how-to guide",2026-05-30
"Write admin guide for administrators","Phase 6: Polish & Testing",Not Started,P0,Documentation,4,"Write user guide for content editors","User management, settings",2026-06-02
"Write developer guide for customization","Phase 6: Polish & Testing",Not Started,P1,Documentation,6,"Write admin guide for administrators","How to add blocks, extend CMS",2026-06-03
"Create API documentation (OpenAPI)","Phase 6: Polish & Testing",Not Started,P1,Documentation,4,"Write developer guide for customization","Complete API reference",2026-06-04
"Record video tutorials","Phase 6: Polish & Testing",Not Started,P1,Documentation,6,"Write user guide for content editors","Screen recordings for key tasks",2026-06-05
"Create migration guide for existing pages","Phase 6: Polish & Testing",Not Started,P1,Documentation,3,"Write developer guide for customization","How to convert hardcoded pages",2026-06-06
"Write troubleshooting guide","Phase 6: Polish & Testing",Not Started,P2,Documentation,2,"Write user guide for content editors","Common issues and solutions",2026-06-06
"Set up production monitoring (Cloud Monitoring)","Phase 6: Polish & Testing",Not Started,P1,DevOps,3,"Phase 5 complete","Metrics, logs, traces",2026-06-09
"Configure error alerting","Phase 6: Polish & Testing",Not Started,P1,DevOps,2,"Set up production monitoring","Alert on errors, downtime",2026-06-09
"Set up performance monitoring","Phase 6: Polish & Testing",Not Started,P1,DevOps,2,"Set up production monitoring","Track response times, throughput",2026-06-09
"Create production deployment checklist","Phase 6: Polish & Testing",Not Started,P0,DevOps,2,"Test all user workflows end-to-end","Pre-deployment verification",2026-06-10
"Perform final staging deployment test","Phase 6: Polish & Testing",Not Started,P0,DevOps,2,"Create production deployment checklist","Full smoke test on staging",2026-06-10
"Deploy to production","Phase 6: Polish & Testing",Not Started,P0,DevOps,2,"Perform final staging deployment test","Blue-green deployment",2026-06-11
"Verify production deployment","Phase 6: Polish & Testing",Not Started,P0,DevOps,1,"Deploy to production","Smoke tests on prod",2026-06-11
"Monitor production for 24 hours","Phase 6: Polish & Testing",Not Started,P0,DevOps,2,"Verify production deployment","Watch for errors, performance issues",2026-06-12
"Conduct final user acceptance testing","Phase 6: Polish & Testing",Not Started,P0,Testing,4,"Deploy to production","Beta testers validate on prod",2026-06-12
"Create project completion report","Phase 6: Polish & Testing",Not Started,P0,Documentation,4,"Conduct final user acceptance testing","Executive summary of project",2026-06-13
"Present to stakeholders","Phase 6: Polish & Testing",Not Started,P0,Documentation,1,"Create project completion report","Demo and Q&A session",2026-06-13
"Plan post-MVP roadmap","Phase 6: Polish & Testing",Not Started,P1,Documentation,3,"Create project completion report","Next features, improvements",2026-06-13
"Celebrate launch! 🎉","Phase 6: Polish & Testing",Not Started,P0,Documentation,0,"Present to stakeholders","Team celebration",2026-06-13
